{
  "schemaVersion": 2,
  "id": "dev.anomaly.ipc-cpp-consumer",
  "name": "IPC C++ Consumer",
  "author": "Anomaly",
  "version": "1.0.0",
  "entry": "plugin.dll",
  "api": {"major": 1, "minMinor": 0, "maxMinor": 0},
  "games": ["nte"],
  "builds": ["nte-*"],
  "loadPhase": "game-ready",
  "dependencies": [
    {"id": "dev.anomaly.ipc-c-provider", "version": ">=1.0.0 <2.0.0"}
  ],
  "services": [{"id": "anomaly.ipc", "minVersion": 1}],
  "capabilities": ["ipc"]
}
