{
  "schemaVersion": 2,
  "id": "example.external-c-sdk",
  "name": "External C SDK",
  "author": "Fixture",
  "license": "AGPL-3.0-only",
  "version": "1.0.0",
  "entry": "plugin.dll",
  "api": {"major": 1, "minMinor": 0, "maxMinor": 0},
  "games": ["nte"],
  "builds": ["nte-*"],
  "loadPhase": "game-ready",
  "services": [{"id": "anomaly.plugin-state", "minVersion": 1, "optional": true}],
  "capabilities": ["configuration"]
}
