{
  "schemaVersion": 2,
  "id": "anomaly.fixture.stop-timeout",
  "name": "Stop Timeout Fixture",
  "author": "Anomaly",
  "version": "1.0.0",
  "entry": "plugin.dll",
  "api": {"major": 1, "minMinor": 0, "maxMinor": 0},
  "games": ["nte"],
  "builds": ["nte-*"],
  "loadPhase": "game-ready",
  "capabilities": []
}
